<?xml version="1.0" encoding="utf-8" ?>

<!DOCTYPE Animation SYSTEM "../DTDs/Animation.dtd">

<Animation>
	<Animation_TS_Filename>Human Unarmed Run.png</Animation_TS_Filename>
	
	<TS_ColorKey_RGB>
		<ColorKey_R>106</ColorKey_R>
		<ColorKey_G>76</ColorKey_G>
		<ColorKey_B>48</ColorKey_B>
	</TS_ColorKey_RGB>
	
	<Sprite_Dimensions>
		<Width>96</Width>
		<Height>96</Height>
	</Sprite_Dimensions>

	<Animation_Characteristics>
		<Frames>9</Frames>
		<Frames_Interval>130</Frames_Interval>
	</Animation_Characteristics>
</Animation>